{
  "schemaVersion": 1,
  "domainId": "knowledge-base-operations",
  "policyResourceIds": ["agent-policy", "directory-map"],
  "readResourceIds": [
    "agent-instructions",
    "version-control",
    "agent-policy",
    "directory-map",
    "test-flow",
    "test-static",
    "test-live",
    "test-external",
    "audit-perspectives",
    "audit-flow"
  ],
  "writeTargets": [
    {
      "id": "knowledge-records",
      "path": "data/knowledge-store.json",
      "operations": ["create", "read", "update", "delete"],
      "versionGuarded": true
    }
  ],
  "denyPathForms": ["absolute", "parent-traversal", "symlink-outside-workspace", "unregistered-resource"]
}
